[
  {
    "timestamp": "2025-08-11T03:00:00.000Z",
    "ph": 6.8,
    "tds": 320.5,
    "temp_c": 22.1
  },
  {
    "timestamp": "2025-08-11T03:30:00.000Z",
    "ph": 6.9,
    "tds": 315.2,
    "temp_c": 22.3
  },
  {
    "timestamp": "2025-08-11T04:00:00.000Z",
    "ph": 7.0,
    "tds": 325.8,
    "temp_c": 22.0
  },
  {
    "timestamp": "2025-08-12T03:00:00.000Z",
    "ph": 6.7,
    "tds": 330.1,
    "temp_c": 21.8
  },
  {
    "timestamp": "2025-08-12T03:30:00.000Z",
    "ph": 6.8,
    "tds": 335.5,
    "temp_c": 22.2
  },
  {
    "timestamp": "2025-08-13T03:00:00.000Z",
    "ph": 7.1,
    "tds": 310.0,
    "temp_c": 22.5
  },
  {
    "timestamp": "2025-08-13T03:30:00.000Z",
    "ph": 7.0,
    "tds": 318.7,
    "temp_c": 22.1
  },
  {
    "timestamp": "2025-08-14T03:00:00.000Z",
    "ph": 6.9,
    "tds": 322.3,
    "temp_c": 21.9
  },
  {
    "timestamp": "2025-08-14T03:30:00.000Z",
    "ph": 6.8,
    "tds": 328.9,
    "temp_c": 22.4
  },
  {
    "timestamp": "2025-08-15T03:00:00.000Z",
    "ph": 7.0,
    "tds": 315.6,
    "temp_c": 22.0
  },
  {
    "timestamp": "2025-08-15T03:30:00.000Z",
    "ph": 6.9,
    "tds": 320.1,
    "temp_c": 22.2
  },
  {
    "timestamp": "2025-08-16T03:00:00.000Z",
    "ph": 6.8,
    "tds": 325.4,
    "temp_c": 21.8
  },
  {
    "timestamp": "2025-08-16T03:30:00.000Z",
    "ph": 7.1,
    "tds": 312.8,
    "temp_c": 22.3
  },
  {
    "timestamp": "2025-08-17T03:00:00.000Z",
    "ph": 7.0,
    "tds": 318.5,
    "temp_c": 22.1
  }
]