[
  {
    "timestamp": "2025-08-07T12:00:00Z",
    "ph": 6.8,
    "tds": 350.0,
    "temp_c": 24.2
  },
  {
    "timestamp": "2025-08-07T12:30:00Z",
    "ph": 6.75,
    "tds": 355.0,
    "temp_c": 24.3
  },
  {
    "timestamp": "2025-08-07T13:00:00Z",
    "ph": 6.72,
    "tds": 360.0,
    "temp_c": 24.5
  }
]